id,title,link,keywords,abstract,authors,affiliations,original_filename,original_id
P028,Shaping an industry's value proposition as a strategic response to an unattainable substitution threshold,https://www.dropbox.com/scl/fi/45i9ap8t63mysf88kv2qz/R_3mmd0Ag0I9DHBSj_Shaping-an-industry-value-proposition.pdf?rlkey=fijvy6pcii6mfua5gu6obn86k&dl=0,Technology substitution; Endogenous shaping; Industry evolution; Photovoltaic cell; Solar,"Technology substitution is a central process in the technology evolution literature, yet our understanding remains largely limited to incumbent firms’ responses and outcomes. For example, existing studies emphasize how incumbents may impede substitution by improving the performance of incumbent technologies such that the substitution threshold shifts upward and becomes unattainable for firms developing new technologies. While such strategic actions by incumbents obstruct the substitution process, surprisingly little is known about the strategic responses available to firms developing new technologies.
We address this lacuna by theorizing shaping as a strategic response available to firms developing new technologies when facing an upward shift in the substitution threshold. Integrating research on technology substitution with the literature on endogenous shaping, we argue that when the substitution threshold becomes unattainable, these firms may attempt to shape the industry’s value proposition by altering consumers’ shared beliefs about the product’s utility and, consequently, about which technological attributes are valuable. This, in turn, redefines the substitution threshold itself, making it attainable again.
We empirically examine our theorization through an in-depth study of the photovoltaic cell industry, combining qualitative and quantitative data. Our analysis reveals a strategic shift among startups following a sharp upward shift in the substitution threshold around 2010, as firms developing new technologies shifted their strategy toward shaping the industry’s value proposition. 
This study expands the repertoire of strategic responses available to new technology firms during substitution processes and advances research on endogenous shaping by identifying conditions under which shaping emerges and how the process unfolds.","Charlotte Jacobs, Gwendolyn Lee",Louisiana State University; Purdue University,R_3mmd0Ag0I9DHBSj_Shaping an industry value proposition.pdf,R_3mmd0Ag0I9DHBSj
P029,When Autonomy Backfires: Adverse Selection in Startup Recruitment,https://www.dropbox.com/scl/fi/rkv24o33snovq6kzi033v/R_43StDMdJX5EBsFX_When-Autonomy-Backfires.pdf?rlkey=vbbo9623sfr1m3bc4243jj1gt&dl=0,"entrepreneurship, early joiner, human capital, autonomy, organizational design","To compete with established firms for talent, startups often highlight their distinctive organizational attributes in recruitment efforts. Using a dataset of 228 million job postings, we first document that autonomy is a particularly prominent attribute: startups increasingly emphasize this organizational design feature, especially when targeting more educated candidates. To assess the efficacy of this strategy, we conduct a pre-registered field experiment in partnership with an actual startup. The results reveal a counterintuitive effect: explicitly emphasizing autonomy attracts less educated candidates while deterring their more educated counterparts. We propose that this adverse selection may arise from education-contingent differences in interpretation. Specifically, more educated job seekers are more likely to construe this emphasis as (1) a marker of generalist work misaligned with their specialized human capital, (2) a sign of organizational dysfunction stemming from excessive autonomy, (3) a compensating differential substituting for inadequate pecuniary compensation, or (4) simply ""cheap talk"" that undermines employer credibility. Together, our findings demonstrate that, although autonomy is a core attribute that distinguishes entrepreneurial ventures from established firms, its explicit emphasis can paradoxically backfire—undermining efforts to attract the high-ability human capital critical to entrepreneurial success.","Saerom (Ronnie) Lee, Reuben Hurst",The Wharton School; University of Maryland,R_43StDMdJX5EBsFX_When Autonomy Backfires.pdf,R_43StDMdJX5EBsFX
P030,From Constraint to Capability: Sustainable Start-ups in Emerging Economies,https://www.dropbox.com/scl/fi/qg6v301jld98sva75pixa/R_4iVF8GHBTeeTq7i_From-Constraint-to-Capability-Sustainable-Start-ups-in-Emerging-Economies.pdf?rlkey=8n2msjmha1kdmjd1l27r56pfu&dl=0,Sustainable entrepreneurship; Dynamic capabilities; Institutional theory; Emerging economies; Start-ups; India; Sustainability-oriented innovation,"Sustainable start-ups play a crucial role in addressing environmental and social challenges, particularly in emerging economies characterized by institutional complexity. Drawing on Dynamic Capability Theory and Institutional Theory, this study examines how sustainable start-ups in India develop dynamic capabilities across the start-up and scaling-up stages of venture growth. Using a qualitative research design, data were collected through in-depth interviews with founders and senior decision-makers from ten sustainability-oriented ventures operating across diverse sectors. The data were analyzed using thematic analysis, enabling the identification of processes related to sensing, seizing, and transforming capabilities. The findings show that sensing capabilities emerge through close engagement with sustainability challenges embedded in local contexts, often supported by informal research and experimentation. Seizing capabilities involve mobilizing resources and legitimacy while responding to normative pressures and market expectations surrounding sustainable products. Transforming capabilities become critical as ventures scale, requiring technological adaptation, process formalization, and continuous navigation of regulatory constraints. Overall, the study demonstrates that dynamic capabilities in sustainable entrepreneurship are shaped by ongoing interactions with institutional environments rather than linear, purely market-driven processes. The findings contribute to a deeper understanding of capability development in sustainability-oriented ventures and offer insights for entrepreneurs and policymakers seeking to support sustainable innovation in emerging economies.",Pallavi Singh,Management Development Institute Gurgaon,R_4iVF8GHBTeeTq7i_From Constraint to Capability- Sustainable Start-ups in Emerging Economies.pdf,R_4iVF8GHBTeeTq7i
P031,"From Bits to Atoms: 3D Printing, Physical Validation, and Firm Growth",https://www.dropbox.com/scl/fi/rnqclxs3590tx1zqgkm6y/R_55Sf2kigW75s2z9_From-Bits-to-Atoms-3D-Printing-Physical-Validation-and-Firm-Growth.pdf.pdf?rlkey=3n1xsi5r6v7bzro8u6p7kg5gt&dl=0,"Innovation, growth, labor market strategy, technology strategy, 3D Printing, Additive Manufacturing","This paper investigates whether and how the adoption of 3D printing affected the growth rate of manufacturing firms in France. Using microdata from 2017 and 2019, we document a robust and positive relationship between 3D printing use and firm growth. To shed light on the underlying mechanisms, we distinguish between innovation-focused and production-focused applications of 3D printing. Our results show that the positive association is primarily driven by the use of 3D printing for internal prototyping, underscoring its role in enabling rapid experimentation and validation of design ideas in physical space. Using matched employer-employee data, we find evidence that firms using 3D printing for prototyping exhibit greater hiring of specialized R&D workers, consistent with the innovation-focused channel. Matching to the community innovation survey (CIS) reveals direct evidence of greater and more-novel product innovation in a large subsample of firms. Overall, our findings highlight that the use of 3D printing enables rapid experimentation and operates as an “invention of a method of invention.”","Kristina McElheran, Luca Fontanelli, Bernardo Caldarola, Elena Verdolini",University of Toronto; University of Brescia; European Commission,R_55Sf2kigW75s2z9_From Bits to Atoms 3D Printing Physical Validation and Firm Growth.pdf.pdf,R_55Sf2kigW75s2z9
P032,"Endurance of chance? A longitudinal study of the U.S. land-grant universities born of luck, serendipity, or both (1862-2024)",https://www.dropbox.com/scl/fi/pevhz1wjmroww74oykzsd/R_5E6RBB51X4tquOZ_Luck-and-serendipity-of-universities-Strategy-Science-Conference.pdf?rlkey=2i58rymhb9vv6fzdjjrbtskqo&dl=0,"imprinting, serendipity, luck, firm heterogeneity","Why do some chance events create enduring organizational imprints while others dissipate? I distinguish between luck (passive receipt of resources without organizational agency) and serendipity (unexpected benefits emerging through organizational action and preparedness), arguing that founding-period chance events vary in their relative composition of luck versus serendipity, creating imprints with varying durability and adaptability. Analyzing 29 U.S. universities from 1862 to 2024 using archival data, contemporary rankings, and enrollment records, I find that all land-grant universities—whether designated through luck, serendipity, or both—excel in agriculture and mechanical arts (A&M) compared to counterfactual peers, consistent with the Morrill Acts’ mandates. Yet, universities whose designations involved greater serendipity maintain A&M excellence more persistently than those driven predominantly by luck. Further, serendipity-dominant universities expanded beyond their original A&M mandates more successfully than luck-dominant ones. This study contributes to imprinting theory by revealing how organizational agency during founding shapes imprint durability and adaptability. It also advances luck and serendipity research by showing how varying compositions of chance events create distinct paths that resist change, providing one answer to why organizations exhibit persistent heterogeneity.",Kunyuan Qiao,Northeastern University,R_5E6RBB51X4tquOZ_Luck and serendipity of universities - Strategy Science Conference.pdf,R_5E6RBB51X4tquOZ
P033,Executives’ Use of Social Media as an Information Channel: Evidence from Digital Paywall Adoption,https://www.dropbox.com/scl/fi/7kp3fe3pdihacw2t1z2ku/R_5FznJ30xQI7rfjz_Executives-Use-of-Social-Media-as-an-Information-Channel.pdf?rlkey=2kdla77ob4hb3i06q847ouloh&dl=0,"Social media, traditional media, information dissemination, media attention, impression management, natural experiment, corporate governance","This study examines the strategic purpose of executives’ social media engagement by investigating whether and how executives use social media to supplement traditional media. Leveraging a natural experiment created by the staggered adoption of digital paywalls by U.S. local newspapers, along with comprehensive data on S&P 1500 executives’ social media activity, we document several findings. First, following local newspaper paywall adoption, executives of local firms significantly increase their posting activity, consistent with efforts to fill the resulting information and attention void. Second, this heightened activity is accompanied by a marked shift toward impression management content. Third, the capital-market implications of executive posts depend on the information environment: although executive posts reduce information asymmetry when local newspapers remain freely accessible, paywall adoption effectively neutralizes this beneficial effect. Cross-sectional analyses further support the proposed mechanisms. The increase in posting volume is concentrated among firms serving informationally disadvantaged retail investors and attention-sensitive consumers, as well as those with high pre-paywall local newspaper coverage. Meanwhile, the shift toward impression management is strongest among firms previously subjected to high local newspaper scrutiny. Finally, we show that executives’ increased social media communication effectively restores the stakeholder attention lost following paywall adoption.","Tiancheng Wang, Philipp Meyer-Doyle, Guoli Chen",INSEAD,R_5FznJ30xQI7rfjz_Executives’ Use of Social Media as an Information Channel.pdf,R_5FznJ30xQI7rfjz
P034,Escaping Stigma: Strategic Responses of Foreign Companies in a Recently Stigmatized Market,https://www.dropbox.com/scl/fi/xhprellk1oe1ejmwwc0kt/R_5LjOkDLwDrtczDv_Escaping-Stigma-Strategic-Responses-of-Foreign-Companies-in-a-Recently-Stigmatized-Market.pdf?rlkey=w5465zqislgca2wwmw9a15liy&dl=0,"stigma, exit strategies, international conflict, foreign market",A socially approved geographic market may become suddenly stigmatized because of events external to organizations that operate in it. Companies will need to decide whether to stay or leave this market to mitigate stigmatization by association. We develop a theory explaining how companies make such a choice. We propose that organizations decide to exit the market when the perceived costs of stigmatization outweigh the benefits from staying. This perception is shaped not only by organizations’ features but also by stigmatizers’ characteristics. We find support to our theory in event-history analyses of multinationals’ exit announcements in the context of the current Russia-Ukraine military conflict that has stigmatized the Russian market as a place for foreign businesses.,"Olga Khessina, Anastasiia Prokopenko, Samira Reis",University of Illinois at Urbana-Champaign; Universidad Carlos III de Madrid,R_5LjOkDLwDrtczDv_Escaping Stigma - Strategic Responses of Foreign Companies in a Recently Stigmatized Market.pdf,R_5LjOkDLwDrtczDv
P035,ASSESSING INITIAL PUBLIC OFFERING (IPO) STRATEGIC GROWTH PIVOTS AND HOW THEY DRIVE FIVE-YEAR OUTCOMES,https://www.dropbox.com/scl/fi/s28u5trj3ce4qtkeg0es3/R_5coLRuRusrgCPX4_ASSESSING-IPO-STRATEGIC-GROWTH-PIVOTS.pdf?rlkey=ucmbtubckodknnbpszr1iiufp&dl=0,"Initial Public Offering, IPO, firm growth, growth pivots, organic and inorganic growth","The initial public offering (IPO) represents a critical inflection point in a firm’s life cycle,
yet little is known about how newly public firms navigate post-IPO growth decisions. In this study, we examine what we term IPO strategic growth pivots by measuring and modeling how post IPO pivots between two different growth modes affect longer-term IPO performance. Note that although there is an ongoing dialogue about two types of IPO growth modes, specifically organic vs. inorganic, to date, we have not seen work that examines the change in growth modes, and that is the focus of the work done in this research. Drawing on longitudinal data from 831 U.S. IPO firms from 2010 to 2015, we analyze how the number of growth-mode pivots affects 5-year firm survival and post-IPO performance. We find that the number of growth-mode pivots exhibits curvilinear relationships with both five-year survival and long-term IPO financial performance. This pattern demonstrates that the rate of change in growth mode pivots entails meaningful costs, a dynamic that is central to change management theory and that helps explain
why performance outcomes depend not only on making changes or pivots but also managing the process by which these pivots are implemented. These findings highlight the complex and outcome-specific consequences of strategic change in the post-IPO context. This study advances research in entrepreneurship and strategic management by elucidating how strategic growth pivots entail distinct trade-offs for survival and performance. The results also offer actionable insights for executives, investors, and policymakers seeking to evaluate or guide strategic decision-making in the high-stakes years following an IPO.","Majid Rahimi, Theresa Welbourne",University of Alabama; The University of Alabama,R_5coLRuRusrgCPX4_ASSESSING IPO STRATEGIC GROWTH PIVOTS .pdf,R_5coLRuRusrgCPX4
P036,Team Composition Responses to Employee Mobility Threats,https://www.dropbox.com/scl/fi/6tyvs5y8gvlhviwm4pxz3/R_5nuUyoFh2JFXHKm_Team-Composition-Responses-to-Employee-Mobility-Threats.pdf?rlkey=1zmxbgm9914dy5wvrdfcromdl&dl=0,"Compositional Redundancy, Employee Mobility, H-1B Visa Portability, Strategic Human Capital, Innovation.","How do firms respond when employees’ mobility barriers weaken? While strategic human capital research has emphasized retention mechanisms that prevent departures, we propose that firms also insure against the disruption-induced departures by increasing compositional redundancy – structuring teams so that members possess overlapping knowledge portfolios. We test this proposition using a quasi-natural experiment: the American Competitiveness in the Twenty-First Century Act (AC21) of 2000, which increased job mobility for H-1B visa holders. Analyzing 31,769 patent-teams in the U.S. electronics industry (1996–2005), we find that teams with greater exposure to the mobility shock exhibit significantly higher knowledge similarity among members post-treatment. This effect is attenuated when potentially mobile inventors have extensive prior collaborative relationships with teammates, suggesting that relational embeddedness substitutes for compositional redundancy as an alternative insurance mechanism. Our findings advance strategic human capital theory by identifying a novel firm response to mobility threats that operates through proactive team restructuring rather than retention or replacement, revealing how organizations can cultivate resilience against human capital risks they cannot prevent.","Deepak Nayak, Kannan Srikanth, Vivek Tandon",The Ohio State University; Temple University,R_5nuUyoFh2JFXHKm_Team Composition Responses to Employee Mobility Threats.pdf,R_5nuUyoFh2JFXHKm
P037,"Nationalism Meets Entrepreneurship: Rise of Buy American Movement and Ideological Recategorization of “Proudly Made in USA,” 2000–2023",https://www.dropbox.com/scl/fi/e08dxi2e1nyrr04ae867u/R_5zpCJQGegT5pjk8_Nationalism_Meets_Entrepreneurship.pdf?rlkey=ule3nyn39augn5fmszacqxhoq&dl=0,"de-globalization, nationalism, entrepreneurship,","Nationalism has reemerged as a defining force of the twenty-first century. We examine how a grassroots nationalist movement transformed the “Made in USA” label from a simple marker of manufacturing origin into a broad ideological category that unified diverse products under a nationalist banner. Drawing on a historical analysis of the Buy American movement (2000–2023), we develop a process model of \textit{ideological re-categorization} to explain how grassroots entrepreneurs redefined a market category and reshaped the nationalism that animated it. The process began with grievance-driven entrepreneurs who mobilized economic nationalism to frame domestic production as moral resistance to globalization. Their success turned the movement into a symbolic resource for political elites, who co-opted its narratives and attracted new ideological joiners, redirecting its meaning toward exclusionary partisan nationalism increasingly detached from its material base in manufacturing. By tracing this cycle of legitimation and co-optation, we show how nationalism, as a “thin-centered” ideology, becomes a category-transforming force through its semantic flexibility and emotional resonance. These insights advance research on organizational nationalism, market categories, and grassroots entrepreneurship by showing how markets become arenas where nationalist sentiments are forged and transformed.","yilang feng, yusaku takeda",university of illinois,R_5zpCJQGegT5pjk8_Nationalism_Meets_Entrepreneurship.pdf,R_5zpCJQGegT5pjk8
P038,Unlocking Digital Value: Efficiency as a Mechanism and CSR as a Catalyst in Firm Performance,https://www.dropbox.com/scl/fi/i5wmt8bszspqsvfeqe23o/R_69soXk1kqiT11wC_digital-transformation-and-efficiency-Manuscript-12.22.2025.pdf?rlkey=59575sp9g4jvbw0ck8dakm2r9&dl=0,Digital transformation; firm performance; firm efficiency; CSR; market value,"Given the rising scholarly interest in the antecedents and consequences of digital transformation, this study investigates how digital transformation affects firm performance and proposes that such effect is mediated by firm efficiency. We also propose and examine the moderating effect of corporate social responsibility (CSR). Using a dataset of 4,760 firm-year observations from U.S. publicly listed companies between 2011 and 2018, our findings demonstrate that digital transformation enhances firm efficiency, which in turn leads to improved firm performance. Moreover, the study finds that CSR strengthens the positive relationship between digital transformation and firm performance, suggesting that firms with higher CSR engagement can derive greater benefits from digital transformation. The results offer valuable insights for both academics and practitioners by highlighting the importance of integrating digital transformation initiatives with efficiency-driven strategies and socially responsible practices. These findings contribute to the literature on digital transformation, firm efficiency, and CSR by providing a comprehensive framework for understanding the interplay between these factors and their impact on firm performance.","Marwan Al-Shammari, Kyung-Ah (Kay) Byun",University of Texas at Tyler; The University of Texas at Tyler,R_69soXk1kqiT11wC_digital transformation and efficiency Manuscript 12.22.2025.pdf,R_69soXk1kqiT11wC
P039,Codification Creep,https://www.dropbox.com/scl/fi/9hgs0ug1ailsi7maewet8/R_6eEPJQZaKPCXK2y_Codification-Creep.pdf?rlkey=v8wk8qd897n161mbjd72k27kt&dl=0,"Codification, Organizational Experience, Tacit Knowledge; Explicit Knowledge; Learning; Novelty; Nuclear Energy","We propose that experienced organizations face a phenomenon we refer to as codification creep: the accumulation of highly transferable but rigid explicit knowledge that crowds out the use of tacit knowledge needed to execute and adapt quickly. Analyzing data from 598 nuclear power plant construction projects worldwide between 1951 and 2016, we find that general contractors become slower with experience: each subsequent plant built around a specific reactor model takes over 18 days longer to complete, and unexpected rain slows experienced contractors further. Interviews and archival records illustrate the codification creep underlying these findings. To self-disrupt codification creep, we show that organizations can introduce planned novelty—by intentionally switching to a new containment building technology—to counteract the drag of past experience.","Goran Calic, Andy Wu",McMaster University; Harvard University,R_6eEPJQZaKPCXK2y_Codification Creep.pdf,R_6eEPJQZaKPCXK2y
P040,The Governability of Strategy: Residual-Claim Ambiguity and Strategy Selection Under Shareholder-Centric Governance,https://www.dropbox.com/scl/fi/ojr0w7d85fc2yz417tllk/R_6jPKKMgZjecY2pr_The-Governability-of-Strategy_-Residual-Claim-Ambiguity-and-Strategy-Selection-Under-Shareholder-Centric-Governance.pdf?rlkey=sjyv8oy4yy1fn6ddfo2cgh3ox&dl=0,"Resource-based theory, agency theory, value creation and capture, stakeholder governance, corporate governance","Agency theory has long shaped strategic management by offering a logic for governing managerial discretion through shareholder-centric governance, which privileges shareholders as primary residual claimants and reduces goal conflict. Yet economic profits often depend on stakeholder-controlled resources whose marginal contributions cannot be fully specified or enforced ex ante. When such incompletely contractible inputs are essential to value creation, residual claims extend beyond shareholders, challenging the conditions under which shareholder-centric governance is efficient. This paper develops a theory of how governance shapes strategy selection in these multi-claimant settings by introducing residual-claim ambiguity: uncertainty over how economic profits should be allocated ex post among multiple contributors who bear residual risk. Residual-claim ambiguity expands managerial discretion over profit allocation and, under shareholder-centric governance, weakens the credibility of commitments to nonshareholder contributors. Anticipating unfavorable allocation, stakeholders respond strategically—through influence activities, bargaining frictions, effort shading, and reduced firm-specific investment—generating efficiency losses. These distributional agency costs are distinct from managerial agency costs, transaction costs, and bargaining costs because they arise from discretionary profit allocation under contested residual claims. This paper argues that distributional agency costs vary systematically across profit-generation mechanisms: novelty and unique complementarities heighten ambiguity because they rely on discretionary, hard-to-measure contributions, whereas scale relies more on standardized, contractible inputs that clarify expected returns. Consequently, shareholder-centric governance creates selection pressure toward scale-based profit generation and away from novelty and complementarities, even when the latter offer greater value-creation potential, reframing governance as a determinant of which value-creation pathways are sustainable.",Adam P Clark,Chapman University,R_6jPKKMgZjecY2pr_The Governability of Strategy_ Residual-Claim Ambiguity and Strategy Selection Under Shareholder-Centric Governance.pdf,R_6jPKKMgZjecY2pr
