id,title,link,keywords,abstract,authors,affiliations,original_filename,original_id
P041,"Mergers and Acquisitions (M&A), Inventor Turnover, and Network Properties",https://www.dropbox.com/scl/fi/fejbm1sba8ro7tnouxlw7/R_6s7znQGHgkmG1nK_Mergers-and-Acquisitions-M-26A-2C-Inventor-Turnover-2C-and-Network-Properties.pdf?rlkey=rx4nvhz0jp7g5epddwqic1qx8&dl=0,"Collaboration / Coordination for Innovation, Social Networks, Mergers and Acquisitions","The acquisition of high-technology acquisitions often triggers significant inventor turnover, jeopardizing the knowledge assets acquirers seek to obtain. Yet, our knowledge of the conditions that accelerate or ameliorate inventor turnover is limited. In this study, we examine how the target inventors’ pre-acquisition productivity and network position shape their post-acquisition mobility decisions. Using data from 139 U.S. technology acquisitions, we find that highly productive inventors and those occupying brokerage positions are less likely to leave. Furthermore, community density, the cohesiveness of a broker’s collaborative community, strengthens this retention effect. We also argue and show that inventor productivity mediates the relationship between brokerage and departure. Our findings advance understanding of post-acquisition human capital retention by specifying individual-level predictors and the mechanisms linking social structure to inventor mobility.","Siddhartha Vivekanand Komati, Deepak Jena, Kannan Srikanth, Rajat Khanna",Cornell University; Indian School of Business; Ohio State University; Tulane University,R_6s7znQGHgkmG1nK_Mergers and Acquisitions (M%26A)%2C Inventor Turnover%2C and Network Properties.pdf,R_6s7znQGHgkmG1nK
P042,"How to Solve Quiet Quitting: Social Media Narratives, Worker Stereotypes, and Managerial Control",https://www.dropbox.com/scl/fi/mkoai3938jw9c1o33z6mz/R_6w1PkZGHQwzxinf_Media-Narratives-and-Managerial-Control-Strategies_SSConference.pdf?rlkey=4i6g2nh8uot182tr3mebsauah&dl=0,"managerial control, management practices, social media, digital platforms, worker stereotypes","Managerial control practices evolve as elite actors—CEOs, business schools, and consulting firms—legitimate new approaches. Yet, platformized journalism increasingly elevates social media narratives—press coverage of viral online content produced by unknown creators seeking to monetize attention. Can such narratives shape managerial cognition, or do managers dismiss them as low-quality inputs to evidence-based decision-making? We examine ‘quiet quitting,’ a news story based on viral TikTok content that received unusually widespread business press coverage in 2022–2023 and framed Gen Z employees as leading a historic rise in counterproductive work behaviors. Our qualitative analysis of news articles (N=170) shows that journalists themselves raised concerns about the narrative’s accuracy, external validity, and newsworthiness, even as the story circulated. Across a series of survey experiments (N=3,167), we find that managers exposed to the dubious quiet quitting narrative did not increase selection of empathetic normative control practices (e.g. town halls, employee surveys). Instead, they significantly increased selection of rational (e.g. pay-for-performance incentives) and coercive control practices (e.g. returning workers to the office, digital surveillance). The narrative activated worker stereotypes about opportunism, and this mechanism persisted even when we provided critical commentary or company-specific indicators of strong work engagement. The findings advance the literature on managerial control by identifying social media narratives as a novel factor that can shape managerial cognition. The study more generally illustrates emerging challenges to collective sensemaking posed by the rising centrality of digital platforms in civic life.","Leroy Gonsalves, Charles Chu",Boston University,R_6w1PkZGHQwzxinf_Media Narratives and Managerial Control Strategies_SSConference.pdf,R_6w1PkZGHQwzxinf
P043,Limits to the Value of Entrepreneurial Experimentation? Startup Scaling Under Varying Demand Conditions,https://www.dropbox.com/scl/fi/72pvplsvh7hvrb4wdtjha/R_78eqX0jMOwDIvTP_Limits-to-the-Value-of-Entrepreneurial-Experimentation-3F-Startup-Scaling-Under-Varying-Demand-Conditions.pdf?rlkey=cxl127j1x1ma2hnajj7camg5u&dl=0,"Experimentation, scaling, scalability, demand conditions, demonetization, digital platform","The benefits of experimentation for firm success and scaling are widely studied in prior research, yet its role under varying demand conditions remains underexplored. This paper examines whether startups change how much they experiment when facing greater demand-side opportunities and how experimentation in turn affects the scaling of these startups. We theorize that demand-side opportunities increase the opportunity costs of experimentation and that strategic commitments inherent in experimentation constrain scaling under favorable demand conditions. Leveraging the 2016 Indian demonetization as a quasi-experiment, we find that experimentation decreased among Indian software startups experiencing stronger demand and startups with greater (recent) experimentation scaled less under these conditions. Additional tests provide evidence consistent with the proposed theory. These findings contribute to the literatures on startup experimentation and scaling.","Jingya You, Deepak Somaya",University of Wisconsin-Madison; University of Illinois Urbana-Champaign,R_78eqX0jMOwDIvTP_Limits to the Value of Entrepreneurial Experimentation%3F Startup Scaling Under Varying Demand Conditions.pdf,R_78eqX0jMOwDIvTP
P044,"Who Counts and Who Decides? Firms, Problems, and Stakeholder Theory",https://www.dropbox.com/scl/fi/9izh85x4uca4lnrj6xtpr/R_7DDdzEPdZIvHf3f_Who-Counts-and-Who-Decides-Firms-2C-Problems-2C-and-Stakeholder-Theory.pdf?rlkey=wumejqfx83y9do87y1el24gcy&dl=0,"Stakeholder Identification, Stakeholder Management, Stakeholder Theory","Scholars and practitioners have a uniform view that stakeholder identification is crucial for the survival of organizations. This view predominantly assumes that the firm is the central organizing unit and that managers identify which stakeholders are important primarily based on power or salience. If this assumption holds, then stakeholders who possess less power or salience are likely to be deemed unimportant and consequently overlooked by organizations. In this study, we argue that the nature of the problem is a critical but missing element in existing explanations of stakeholder identification. We replace the firm as the unit of analysis and instead position the problem as the central organizing basis for stakeholder identification. We present a typology of mutuality problems: simple, complex, and wicked. By emphasizing the nature of the problem, our approach enables a more nuanced and dynamic understanding of stakeholder identification, moving beyond rigid categorizations such as powerful versus weak stakeholders. By developing theory at the problem level, we show how organizations can more accurately identify the stakeholders most essential to their long-term survival.","Prem Sagar Menghwar, Ed Freeman","Darden School of Business, University of Virginia",R_7DDdzEPdZIvHf3f_Who Counts and Who Decides Firms%2C Problems%2C and Stakeholder Theory.pdf,R_7DDdzEPdZIvHf3f
P045,Other People’s Children: How Diversity Without Inclusion Impacts Community Support for Public Schools,https://www.dropbox.com/scl/fi/m95dfdffz193xn3kyqnjz/R_7Ep50Lk2u7AjJW6_Other_People-s_Children_How_Diversity_Without_Inclusion_Impacts_Community_Support_for-Public_Schools.pdf?rlkey=pw6qvzcmfssaqljma3v1xf4p2&dl=0,"Nonmarket & Political Environment, Public Management, Diversity in Organizations, Organization Design","Organizations pursuing activities that advance the public interest often require support from their local communities, but such support may be harder to come by in more racially diverse communities if diversity undermines civic participation. In this study, we argue that this negative effect of racial diversity on support for organizations serving the public interest will be weaker the more inclusive the community, especially where community inclusion is accompanied by shared values among members of different groups and where the organizations themselves are racially representative. We test and find support for these predictions by looking at one specific type of public-service organization: public schools in the
United States. Specifically, we find that community support for public schools—both generally in terms of local spending per pupil and specifically as the bond amounts residents vote to approve—is negatively associated with racial diversity within a school district, but this negative relation only holds for less inclusive communities where members of different groups are less likely to live close to each other or to have social ties with each other. We further find that this moderating effect of community inclusion is complemented by shared values and organizational representativeness, so that diversity has the most negative effect in less inclusive communities where members of different races differ in their political beliefs and schools are relatively segregated, and no significant effect in inclusive communities with shared values and integrated schools. Our study sheds new light on the conditions under which organizations seeking to address grand challenges can benefit from strong community support.","Farzam Boroomand, Aseem Kaul",University of South Carolina; University of Minnesota,R_7Ep50Lk2u7AjJW6_Other_People’s_Children_How_Diversity_Without_Inclusion_Impacts_Community_Support_for Public_Schools.pdf,R_7Ep50Lk2u7AjJW6
P046,Learning About Roads Not Taken,https://www.dropbox.com/scl/fi/s9q7o9uue4ga6qc54748w/R_7MSPZq3RUY4TJ83_Learning-About-Roads-Not-Taken.pdf?rlkey=rmzq8mrl9hmd5ptkxmve429j8&dl=0,Organizational learning; search; generalization; computational model; pharmaceutical innovation,"Organizational experience is often scarce, making the ability to enrich it through generalization a central feature of learning. However, the consequences of learning in this way remain poorly understood. How does generalization shape the balance between omission and commission errors, and which organizations rely on it more? We develop a computational model that shows how generalization makes learning more efficient by spreading feedback across related alternatives, but this efficiency comes at the cost of increased omission errors. The model further predicts that the optimal degree of generalization depends on the nature of the firm's prior experience. We test these predictions using data on clinical trial failures. Consistent with the model, pharmaceutical firms reduce investment in biologically related drug targets, with the most significant declines occurring for proximate high-merit targets. The effects are larger for firms with more limited or concentrated experience, suggesting that generalization is an imperfect yet useful substitute for direct knowledge. These findings highlight both the promise and the pitfalls of generalization in settings where experience is limited.","Daniel Schliesmann, Matteo Tranchero","The Wharton School, University of Pennsylvania",R_7MSPZq3RUY4TJ83_Learning About Roads Not Taken.pdf,R_7MSPZq3RUY4TJ83
P047,"Social Exposure, Innovator-Consumer Homophily, and Inequality: Evidence from College Peers",https://www.dropbox.com/scl/fi/j75mj7shfo3s311slwk28/R_7QEqe4EfrpeTd2T_Social-Exposure-2C-Innovator-Consumer-Homophily-2C-and-Inequality-3B-Evidence-from-College-Peers.pdf?rlkey=miuqewpqsed7tzc4o3fva3k70&dl=0,"Entrepreneurship, peer effects, homophily","We investigate the importance of social networks for the direction of entrepreneurship and innovation. Using quasi-experimental variation in the gender and socioeconomic composition among college peers in Finland, we show that exposure to lower-income peers increases the likelihood that an entrepreneur founds a firm in a necessities industry without affecting entrepreneurial income. Likewise, increased exposure to female peers increases entrepreneurial activities targeting female consumers. These effects are largest among groups over-represented in innovation: men and individuals from high-income backgrounds. We assess the macro implications of this heterogeneity in an endogenous growth model and find that differences in college peer composition explain around a quarter of the observed inventor–consumer homophily by gender, inducing a significant cost-of-living disadvantage for women. These findings show that innovators’ social experiences have a causal impact on the direction of innovation, independent of financial incentives.","Josh Feng, Elias Einio, Xavier Jaravel",University of Utah - David Eccles School of Business; VATT; London School of Economics,R_7QEqe4EfrpeTd2T_Social Exposure%2C Innovator-Consumer Homophily%2C and Inequality%3B Evidence from College Peers.pdf,R_7QEqe4EfrpeTd2T
P048,How Unique Is Enough? Startups’ Market Positioning Relative to Peers and Funding Outcomes in Accelerators,https://www.dropbox.com/scl/fi/z2pp7j4vzc1xoqdy8jl70/R_7WPoy3T8G30uwsp_acc_how-unique_Jan-15-2026ss.pdf?rlkey=ftukcqda31r6guy2vyd49h51z&dl=0,"market position, entrepreneurship, accelerator, funding","Startups in accelerators are evaluated in direct comparison with cohort peers, yet we know little about how a venture’s relative market position within its cohort is associated with funding outcomes. Prior research offers competing predictions: optimal distinctiveness theory highlights a trade-off between competitive advantage and legitimacy, while entrepreneurial learning emphasizes the benefits of similarity for knowledge acquisition.  Using data on 3,205 U.S. startups in 189 cohorts across 26 accelerator programs (2005–2018), along with a matched sample of comparable non-accelerated startups, we measure a venture’s cohort market position as its industry similarity to cohort peers. We find an inverted U-shaped relationship between industry similarity and overall funding within two years post-graduation: ventures with moderate distinctiveness raise the most overall capital. In contrast, funding from high-reputation VCs increases with distinctiveness, favoring highly unique market positions. These results reconceptualize cohort effects as relative distinctiveness within the cohort and highlight the critical role of investor attributes—particularly reputation—in shaping funding outcomes.",JungYun Han,National Taiwan University,R_7WPoy3T8G30uwsp_acc_how unique_Jan 15  2026ss.pdf,R_7WPoy3T8G30uwsp
P049,Lobbying the Court,https://www.dropbox.com/scl/fi/sauade9qo7wb4pa41q4he/R_7gU6YC7DQjB1Cr8_lobbyingthecourt.pdf?rlkey=etv81jtxyk6yxdecrgt8pdean&dl=0,"corporate political activity, lobbying, courts, patents, dataset","A substantial body of strategic management research examines lobbying as a key corporate political activity, yet it primarily focuses on firms lobbying the legislative and executive branches of government. By contrast, lobbying directed at the judiciary—the third branch—remains largely overlooked, despite courts’ critical role in shaping competitive landscapes and firms’ frequent efforts to influence judicial decisions for favorable policy outcomes. In this dataset article, we shift attention to courts as policymakers for firms, outline how firms lobby courts, and introduce a novel dataset capturing lobbying activities targeting the U.S. Supreme Court in the context of patent law. By advancing understanding of court lobbying and providing new data, we aim to stimulate future research on this consequential but understudied form of corporate political activity.","Jiao Luo, Elie Sung, Yasir Dewan",U of Minnesota; HEC Paris,R_7gU6YC7DQjB1Cr8_lobbyingthecourt.pdf,R_7gU6YC7DQjB1Cr8
P050,Data Privacy Regulation and Innovation,https://www.dropbox.com/scl/fi/pchbl4rwgnvac8zi7ejp0/R_7thfcuz5hY6y3m5_Data-Privacy-Regulation-and-Innovation.pdf?rlkey=hqeo4g7sejwu0v995fvtvb51x&dl=0,Innovation; Privacy; Regulation; Collaboration; Experimentation,"We investigate how data privacy regulations shape firms’ research and development
decisions. While such regulations aim to increase stakeholder privacy and data security,
they can also introduce compliance costs in settings where collecting, analyzing,
and sharing sensitive data is central to innovation. We examine this tension in the
context of the European Union’s General Data Protection Regulation (GDPR) and
the pharmaceutical industry. Using detailed clinical trial data and firm-level variation
in exposure to the GDPR, we find that GDPR reduces clinical trials by 18 percent,
and declines persist even after accounting for shifts in disease composition. GDPR also
shifts research processes: firms conduct trials across fewer sites and countries. Research
collaborations decline overall, particularly among young firms, and shift away from new
partners towards established relationships. Finally, the GDPR shifts innovation outcomes:
trials take longer to complete, are less likely to complete successfully, and results
are reported with a greater delay. These findings reveal how data privacy regulations
shape not only the rate of innovation, but also the process by which it is pursued and
its outcomes.","Sukhun Kang, Jennifer Kao",UCSB; UCLA,R_7thfcuz5hY6y3m5_Data Privacy Regulation and Innovation.pdf,R_7thfcuz5hY6y3m5
P051,The Limits of Carbon Reporting,https://www.dropbox.com/scl/fi/nz1a7gkpdh7qt8e4y9712/R_80GwNdmLtZWHVDT_SS_The-Limits-of-Carbon-Reporting.pdf?rlkey=czgwutwzcyjzr530bvh2msd77&dl=0,"Carbonwashing, Satisficing, Organizational identification, Sustainability-specific sensegiving, CEO duality","This study advances a behavioral perspective of carbonwashing by conceptualizing it as a satisficing carbon reporting strategy shaped by CEO duality. We argue that CEO duality intensifies organizational identification, creating strong impetus for dual CEOs to demonstrate commitment to sustainability norms and secure legitimacy while avoiding the economic and operational costs associated with full transparency. We further theorize that sustainability-specific sensegiving mechanisms, including sustainability-linked compensation and committee, reorient dual CEOs' identification toward substantive environmental action over symbolic reporting, thereby attenuating carbonwashing. Using a sample of 3,218 firm-year observations across 644 firms in 31 countries while addressing endogeneity concerns, we find that CEO duality amplifies carbonwashing, but this effect is significantly attenuated by sustainability-linked bonus and sustainability committee.","Ramakrishna Devarakonda, Maria Roszkowska-Menkes",Tilburg University; Université catholique de Louvain,R_80GwNdmLtZWHVDT_SS_The Limits of Carbon Reporting.pdf,R_80GwNdmLtZWHVDT
P052,Using Machine Learning to Estimate the Effect of General Partners on Venture Capital Performance,https://www.dropbox.com/scl/fi/q131cqxmx9zepmdgigud4/R_85LpESGOtnHwNrZ_Using-Machine-Learning-to-Estimate-the-Effect-of-General-Partners-on-Venture-Capital-Performance.pdf?rlkey=63d7d5fengwjpdz0m7juj5hmt&dl=0,Venture capital; General partners; Machine learning; Performance persistence,"Despite extensive research on performance persistence in the venture capital (VC) industry, evidence supporting the common assumption that general partners drive such persistence is limited. In this paper, we employ machine learning methods to quantify the effect (if any) of general partners (GPs) on performance persistence across multiple VC funds. Analyzing 29,021 quarterly observations from 722 funds managed by 811 general partners between 1997 and 2022, we document statistically significant, albeit modest, effects of GPs on performance persistence. These magnitudes are substantially smaller than those found in the literature, highlighting the limited external validity of traditional methods. We also find that GP effects consistently exceed VC firm effects, suggesting that individual-level analyses provide greater insights than firm-level ones. Broadly, our results suggest that most of the variation in VC performance is not attributable to the organizational characteristics of VC firms and can be only partially explained by the individuals managing them.","Pietro Morino, Corrado Botta, Mario Daniele Amore",Bocconi University,R_85LpESGOtnHwNrZ_Using Machine Learning to Estimate the Effect of General Partners on Venture Capital Performance.pdf,R_85LpESGOtnHwNrZ
P053,DOES IMITATION HELP OR HARM PERFORMANCE? BOUNDARY CONDITIONS AND LONGITUDINAL EVIDENCE FROM S&P 500 FIRMS,https://www.dropbox.com/scl/fi/2q9tgjhjoo8z7tl3d38ru/R_8OBpBSkR53iKKFu_Manuscript_Imitation.pdf?rlkey=o0pho6womtcwmh0mjqq1qpr8o&dl=0,: Imitation; innovation; firm performance; topic modelling; S&P500,"Strategy research is divided on whether imitation erodes or builds competitive advantage, with contradictory theoretical assumptions and sparse empirical evidence. We address this impasse using text-based measures that capture latent information on imitation as strategic convergence around innovation topics. Analyzing nearly ten thousand annual reports from S&P500 firms across fifteen years, we provide novel large-scale empirical evidence reconciling static and dynamic imitation theories. Imitation benefits shareholder returns and short-term operational performance via capability building but erodes long-term profitability. Critically, we establish boundary conditions: sectoral uncertainty enables learning and amplifies imitation benefits, whereas global uncertainty creates strategic paralysis. Firm strength shows minimal moderation, rendering imitation as a democratic strategy. Our findings integrate temporal, environmental, and organizational contingencies governing when imitation builds versus erodes competitive advantage.","Erik Lang, William Ericson, Ivan Belik",Norwegian School of Economics; Stockholm School of Economics,R_8OBpBSkR53iKKFu_Manuscript_Imitation.pdf,R_8OBpBSkR53iKKFu
P054,Competitiveness Framing and VC Investment,https://www.dropbox.com/scl/fi/93g6f1oipm6250edl1r3i/R_8PHWjldhDhy5Us4_Competitiveness-Framing-and-VC-Investment.pdf?rlkey=xcbqxbqrjw6reh0dj05pcoc81&dl=0,"venture capital, entrepreneurial framing, female founders, expectancy violation theory","Ventures led by female founders encounter disadvantages in securing venture capital (VC) financing. We argue that female founders can mitigate this gap by adopting competitiveness framing—language that highlights a competitive position and orientation. Although this framing violates traditional gender expectations, we draw on expectancy violation theory to theorize that it signals desirable competence and will be perceived positively by VCs. Based on a sample of 1,579 U.S. IT ventures, we find that the gender gap in investment diminishes when female founders use a higher level of competitiveness framing. Furthermore, this effect is amplified when VCs have prior investment ties with the venture, underscoring the joint importance of counter-stereotypical framing and venture-VC familiarity in entrepreneurial finance.","Yajing Li, Xiumei Li, Donal Crilly",lehigh university; University of Manitoba; London Business School,R_8PHWjldhDhy5Us4_Competitiveness Framing and VC Investment.pdf,R_8PHWjldhDhy5Us4
P055,Shaping interfirm relationships in intermediary markets: Evidence from a field experiment,https://www.dropbox.com/scl/fi/2z7yiyfwiwcxsynvnufkx/R_8QDMYay1ekwOnBz_Shaping-interfirm-relationships-in-intermediary-markets-Evidence-from-a-field-experiment.pdf?rlkey=zxem8m5v7t2yn7vaiwx0yveg5&dl=0,"field experiment, interfirm relations, relational assets, intermediary markets","Prior work highlights the value of relation-specific assets and knowledge-sharing routines
in interfirm relationships, but little is known about how short-term interventions
can build these resources. We propose that temporary transactional benefits encourage
engagement, leading to accumulated firm-specific knowledge and relational assets. In
a field experiment with a travel company that distributes products via intermediaries,
253 of 757 independent agencies were randomly granted access to a service hotline, lowering
transaction costs for frontline agents and facilitating knowledge transfer about
the firm’s products and processes. Sales increase in response to the intervention, in
particular among agencies with weaker prior ties, showing such initiatives help cultivate
new relationships. The treatment effects persist beyond the period of the intervention
and extend to non-targeted products, indicating durable relational resources.","Max Thon, Oliver Gürtler, Matthias Heinz, Kai Schäfer, Dirk Sliwka",University of Zurich; University of Cologne,R_8QDMYay1ekwOnBz_Shaping interfirm relationships in intermediary markets Evidence from a field experiment.pdf,R_8QDMYay1ekwOnBz
