id,title,link,keywords,abstract,authors,affiliations,original_filename,original_id
P015,The Mean-Variance Innovation Tradeoff in AI-Augmented Evaluations,https://www.dropbox.com/scl/fi/7nyjnyskzm2ftxxb9ydt7/R_2LZHaUNn9QVYtQH_StrategyScience_The-Mean-Variance-Tradeoff.pdf?rlkey=1a9d4tu9cxg4javvb758l0j03&dl=0,Innovation evaluation; human-AI collaboration; generative AI and predictive AI; novelty and feasibility; field experiment.,"Evaluating and selecting among numerous alternative solutions shapes the trajectory and rate of innovation. Central to this process is a fundamental tension between novelty and feasibility that evaluators, operating under bounded rationality, cannot consider simultaneously and therefore rely on heuristics to guide their evaluations. A common heuristic is criteria-sequencing, in which evaluators prioritize alternative criteria at different evaluation stages. Yet, the idiosyncratic ways evaluators sequence these criteria often introduce inconsistencies, creating significant path dependencies in the process. In this paper, we propose that artificial intelligence (AI) offers a potential lever to structure evaluators’ criteria-sequencing heuristics. Leveraging a field experiment with 353 evaluators, we investigate how the sequencing of AI recommendations focusing on novelty and feasibility shapes the mean and variance of innovation among selected solutions. Our results reveal a mean–variance innovation tradeoff: a feasibility-then-novelty sequence leads to selections with higher mean innovation, whereas a novelty-then-feasibility sequence yields selections with greater innovation variance. Furthermore, a post hoc analysis uncovers that the format accompanying AI recommendations also matters. A dynamic format (i.e., interactive chatbot) increases the innovation variance among selected solutions but reduces their mean innovation relative to a static format (i.e., fixed explanatory content). Because these effects operate independently, our findings show that in AI-augmented evaluations, both the sequence of criteria and the format accompanying AI recommendations shape the mean–variance innovation tradeoff. These differences have important implications for the composition of innovation portfolios. Our paper contributes to innovation evaluation research and to emerging literature on human–AI collaboration in innovation-related contexts.","Cyrille Grumbach, Jacqueline Ng Lane, Georg von Krogh",ETH Zurich; Harvard Business School,R_2LZHaUNn9QVYtQH_StrategyScience_The Mean-Variance Tradeoff.pdf,R_2LZHaUNn9QVYtQH
P016,"Delegation, Attention Allocation, and Innovation in Entrepreneurial Ventures",https://www.dropbox.com/scl/fi/t8ku92s2xhu47pkrio05y/R_2LirCqtSar6sVFN_Delegation-2C-Attention-Allocation-2C-and-Innovation-in-Entrepreneurial-Ventures.pdf?rlkey=mxwgtd5b86higkvtd7a5b19nr&dl=0,Entrepreneurship; innovation; delegation; task allocation; resource constraints; German SOEP.,"Despite growing recognition that organizational design can facilitate entrepreneurs' attention allocation to high-value activities that improve firm innovation, few studies have tested this theoretical insight. Guided by organizational structure and managerial frictions literature in innovation and entrepreneurship, we examine how and why shared decision rights affect innovation outcomes. In a representative survey of German entrepreneurs, delegation has a strong, robust, positive association with incremental innovation; evidence for alternative innovation outcomes or differential effects of delegation depth is limited. This relationship varies slightly with incentives, employee, and founder ability, and is stronger in East Germany, where managerial frictions are larger. While delegation does not free up time for personal activities, it allows entrepreneurs to engage in a greater number of venture activities, especially crafting strategy, and perform them more intensely. Collectively, our findings imply delegation enhances innovation by facilitating entrepreneurs' attention allocation to critical managerial tasks, such as acquiring market and competitor insight or making growth and investment choices. By clarifying where the value of delegation resides and what activities founders prioritize, we highlight the importance of strategy in entrepreneurial ventures.","Theodor Vladasel, Alexander Kritikos, Knarik Poghosyan",Universitat Pompeu Fabra; DIW Berlin,R_2LirCqtSar6sVFN_Delegation%2C Attention Allocation%2C and Innovation in Entrepreneurial Ventures.pdf,R_2LirCqtSar6sVFN
P017,The Portability of Network Effects: How Platform Dependent Entrepreneurs Respond to Adverse Governance Shocks,https://www.dropbox.com/scl/fi/v28xy9qau13o4v48q8zvu/R_2QDIGVghvQigUUd_Portability-of-Network-Effects.pdf?rlkey=thow1ax2m07ydtjuga36b0uxf&dl=0,"Platform, Digital Platform, Entrepreneurship, Network effects","This paper examines how Platform Dependent Entrepreneurs (PDEs), whose viability depends on platform-controlled access, discoverability, enforcement, and monetization, respond to an adverse governance shock imposed unilaterally by the platform owner, and how PDE relational capital conditions this response. Adopting a mixed method study design this paper examines granular streaming data from July–December 2022 and a subsequent qualitative study of archival sources including PDE communication and video streams, industry expert reports, and popular press. I trace strategic responses of PDEs to an adverse governance shock that threatens their core activity on the focal platform. The analysis shows that network effects are partly portable. High relational capital enables PDEs to port a significant userbase from focal platform to an alternate platform, challenging the dominant platform lock in view. Moreover, an adverse governance shock can lead to the Hydra effect: whereby restrictive policy changes intended to suppress a targeted activity instead catalyse its reconfiguration and relocation at an alternate venue. These findings refine boundary conditions on platform power by showing that dependence is contingent on the portability of relational capital.",Nilesh Singhania,IE Business school,R_2QDIGVghvQigUUd_Portability of Network Effects.pdf,R_2QDIGVghvQigUUd
P018,The Portability of Network Effects: How Platform Dependent Entrepreneurs Respond to Adverse Governance Shocks,https://www.dropbox.com/scl/fi/d0rl5d1b7nip036359iq1/R_2fQ0dGnqCS11fHz_Portabilityof-Network-effects.pdf?rlkey=t7itbkehevyzsq14vea8gzsb8&dl=0,"Platform, Digital Platform, Entrepreneur, Network effects, Platform Governance","This paper examines how Platform Dependent Entrepreneurs (PDEs), whose viability depends on platform-controlled access, discoverability, enforcement, and monetization, respond to an adverse governance shock imposed unilaterally by the platform owner, and how PDE relational capital conditions this response. Adopting a mixed method study design this paper examines granular streaming data from July–December 2022 and a subsequent qualitative study of archival sources including PDE communication and video streams, industry expert reports, and popular press. I trace strategic responses of PDEs to an adverse governance shock that threatens their core activity on the focal platform. The analysis shows that network effects are partly portable. High relational capital enables PDEs to port a significant userbase from focal platform to an alternate platform, challenging the dominant platform lock in view. Moreover, an adverse governance shock can lead to the Hydra effect: whereby restrictive policy changes intended to suppress a targeted activity instead catalyse its reconfiguration and relocation at an alternate venue. These findings refine boundary conditions on platform power by showing that dependence is contingent on the portability of relational capital.",Nilesh Singhania,IE Business School,R_2fQ0dGnqCS11fHz_Portabilityof Network effects .pdf,R_2fQ0dGnqCS11fHz
P019,Board Gender Quotas and Women's Entrepreneurship: The Critical Role of Financial Development,https://www.dropbox.com/scl/fi/hhn2zhlqixkjz0b8b4el3/R_38Sxo1vZdIfXR6s_Board-Gender-Quotas-and-Women-s-Entrepreneurship-3B-The-Critical-Role-of-Financial-Development.pdf?rlkey=aqqnex2qgpkdtewn5lejxuwvq&dl=0,Board gender quotas; Women entrepreneurs; Financial development; Entrepreneurial entry,"This study examines how board gender quotas shape women’s career choices by influencing their relative propensity to pursue entrepreneurship. Using a meta-analytic approach, we propose a theoretical framework distinguishing between two mechanisms: quotas may either redirect women toward corporate careers by signaling organizational receptiveness (substitution effect) or inspire entrepreneurial ventures by providing visible leadership role models (inspiration effect). Our analysis demonstrates that these effects operate conditionally rather than universally. In countries with limited financial development, capital access constraints amplify the substitution effect, as quotas make corporate positions relatively more attractive than entrepreneurship. Conversely, in financially developed economies where women face fewer financing barriers, the inspiration effect predominates, with board representation encouraging venture creation. Beyond quota effects, we find that financial development independently increases women's relative entrepreneurial propensity. These findings underscore that institutional interventions like gender quotas produce heterogeneous outcomes depending on complementary institutional infrastructures, particularly financial systems that determine entrepreneurial feasibility.","Hatameh Ahmadi Harandi, David Gaddis Ross, Dong Hyun Shin",UF; Universoty of Florida; City University of Hong Kong,R_38Sxo1vZdIfXR6s_Board Gender Quotas and Women's Entrepreneurship%3B The Critical Role of Financial Development.pdf,R_38Sxo1vZdIfXR6s
P020,Performance as a Random Variable,https://www.dropbox.com/scl/fi/pqdogues20pwe65i3vnmr/R_3Bi0HsPL4dNwZip_Performance_as_a_Random_Variable-SS.pdf?rlkey=5ax6i9lztx3l0c9l6kpbptfai&dl=0,"Strategic Human Capital Management, Hiring, Formal Theory, Performance, Entrepreneurship","Individual performance is stochastic, but strategic human capital research evaluates workers and policies only in terms of mean or expected performance. This omission embeds strong but rarely stated assumptions about organizations’ ability to absorb bad draws and capitalize on good ones. Using a portfolio model in which hiring managers choose between reliable (lower-mean, low-variance) and volatile (higher-mean, high-variance) workers, I examine how organizational wealth, scale, team composition, and production interdependence shape exposure to performance risk. The analysis shows that fragile, resource-constrained, or tightly coupled organizations pay a volatility tax and should favor reliability, whereas large, well-capitalized, or modular organizations can take advantage of more volatile talent. I develop this insight as Human Capital Portfolio Management and discuss implications for research in strategic human capital, entrepreneurship, and organizational theory.",Isaac Tucker,UCLA Anderson,R_3Bi0HsPL4dNwZip_Performance_as_a_Random_Variable - SS.pdf,R_3Bi0HsPL4dNwZip
P021,Democratizing Entrepreneurial Ecosystems: How Accessible AI Reshapes the Geography of Entrepreneurship,https://www.dropbox.com/scl/fi/m52sirwamgtaw2dmfoaf4/R_3NtGbh1R8CY5yjn_Democratizing-Entrepreneurial-Ecosystems.pdf?rlkey=97zx0myouo42p97w7vv7hn97j&dl=0,"AI, Entrepreneruship, Entrepreneurial Ecosystem","Entrepreneurial activity is highly uneven across space, with a small number of high-volume ecosystems accounting for a disproportionate share of startups. This paper examines whether universally accessible artificial intelligence, specifically large language models (LLMs), alters this geography. We theorize LLMs as synthetic human capital that democratizes entrepreneurship through capability enhancement and task internalization in resource-scarce ecosystems. Using ChatGPT’s November 2022 release as a quasi-experimental shock, we analyze 6.2 million new firm formations across 843 U.S. metropolitan and micropolitan areas. Entrepreneurial entry increases across all ecosystems following ChatGPT’s release, with significantly larger proportional increases in low-volume ecosystems. These findings demonstrate that accessible AI can partially substitute for missing complementary resources, contributing to research on entrepreneurial ecosystems, AI in strategy and entrepreneurship, and task-based theories.",U. David Park,Syracuse University,R_3NtGbh1R8CY5yjn_Democratizing Entrepreneurial Ecosystems.pdf,R_3NtGbh1R8CY5yjn
P022,Agglomeration Economy Dynamics and Demand Spillovers: Restaurant Week Effect on Participants’ Neighbors,https://www.dropbox.com/scl/fi/2qwyaornh41yq0xyisl1b/R_3OWmRX2XefhEB0d_Agglomeration-Economy-Dynamics-and-Demand-Spillovers.pdf?rlkey=tiu0kmzgfrs45nfui4j729qa1&dl=0,"Agglomeration, geography, demand-side spillovers","Agglomeration economies generate benefits for agglomerated firms. How benefits propagate through an agglomeration is unclear because agglomerations are composed of multiple firms and each firm engages in various activities that might have spillover implications for neighbors. To observe this propagation and identify underlying mechanisms, we leverage some firms taking a specific strategic action that generates benefits for themselves that might spill over to neighbors. Focusing on demand-side (vs. supply-side) agglomeration benefits, we expect that neighbors will benefit more when geographically closer to the action-taking firms (due to lower customer search costs) or when selling similar goods to the action-taking firms (due to what customers the strategic action attracts), but benefit less when both geographically closer and selling similar goods (due to localized competition). Using a quasi-natural experiment featuring establishment-level micro-geographic data of restaurants participating in “Restaurant Week” in Washington DC (an event to stimulate demand), we find that Restaurant Week participants’ neighbors experience heightened demand for several weeks after Restaurant Week. Consistent with our expectations: neighbors benefit more when geographically closer or if selling similar goods to Restaurant Week participants. But the benefit for neighbors selling similar goods is delayed a couple weeks, which is consistent with localized competition initially offsetting spillover benefits. Our results demonstrate how firms taking specific strategic action can lead to spillovers propagating throughout an agglomeration, and how overlapping mechanisms determine who benefits and how much.","Roxanne Jaffe, Siddharth Sharma, Wilbur Chung",Vanderbilt University; Indian School of Business; University of Maryland,R_3OWmRX2XefhEB0d_Agglomeration Economy Dynamics and Demand Spillovers.pdf,R_3OWmRX2XefhEB0d
P023,The Strategic Foresight of LLMs,https://www.dropbox.com/scl/fi/uew5xbcj322l4t0svw4os/R_3RndgrhAQREX6il_The-strategic-foresight-of-LLMs.pdf?rlkey=w1gok9aj7ycl942d96x9ameyw&dl=0,artificial intelligence; strategic foresight; strategic decision-making; opportunity evaluation; strategic uncertainty,"Can artificial intelligence outperform humans at strategic foresight—the capacity to form accurate judgments about uncertain, high-stakes outcomes before they unfold?  We address this question through a fully prospective prediction tournament using live Kickstarter crowdfunding projects.  Thirty U.S.-based technology ventures, launched after the training cutoffs of all models studied, were evaluated while fundraising remained in progress and outcomes were unknown.  A diverse suite of frontier and open-weight large language models (LLMs) completed 870 pairwise comparisons, producing complete rankings of predicted fundraising success.  We benchmarked these forecasts against 346 experienced managers recruited via Prolific and three MBA-trained investors working under monitored conditions.  The results are striking: human evaluators achieved rank correlations with actual outcomes between 0.04 and 0.45, while several frontier LLMs exceeded 0.60, with the best (Gemini 2.5 Pro) reaching 0.74—correctly ordering nearly four of every five venture pairs.  These differences persist across multiple performance metrics and robustness checks.  Neither wisdom-of-the-crowd ensembles nor human-AI hybrid teams outperformed the best standalone model.","Felipe Csaszar, Aticus Peterson, Daniel Wilde",University of Michigan; New York University; Indiana University,R_3RndgrhAQREX6il_The strategic foresight of LLMs.pdf,R_3RndgrhAQREX6il
P024,"Common Ownership, Firm Hiring and the Allocation of Human Capital",https://www.dropbox.com/scl/fi/f3zdl14z8jdkafa0riqc8/R_3cY5yJVcMCxuiTJ_Common-Ownership-2C-Firm-Hiring-and-the-Allocation-of-Human-Capital.pdf?rlkey=9uiropoo3m1bpviim6rxuqc05&dl=0,common ownership; human capital; venture capital; competition; innovation,"We study how common ownership shapes the allocation of human capital across firms. We construct a novel dataset combining LinkedIn-based employment histories with data on venture capital (VC) investments in U.S. startups. Exploiting the staggered adoption of liability waivers that allow investors to hold stakes in competing business opportunities as a plausibly exogenous shock to common ownership, we show that ventures with shared investors employ more workers, pay higher wages, and experience greater turnover than independent ones. At the same time, common ownership increases job-to-job mobility within investor portfolios, suggesting that shared investors facilitate the reallocation of workers across portfolio firms. Aggregating to the local market level, we find that common ownership significantly increases worker mobility without depressing overall employment or wages, though these positive effects weaken in more concentrated labor markets. Taken together, the results are consistent with coordination synergies that relax matching frictions outweighing potential monopsony effects.","Mario Leccese, Zeyang Xue",Boston University,R_3cY5yJVcMCxuiTJ_Common Ownership%2C Firm Hiring and the Allocation of Human Capital.pdf,R_3cY5yJVcMCxuiTJ
P025,To Balance or Not To Balance: Resource-Contingent Performance to Exploration–Exploitation Orientation,https://www.dropbox.com/scl/fi/jzw9eukji1f9dnmkn0vb5/R_3kNTV5GHIpitNlN_To-Balance-or-Not-to-Balance.pdf?rlkey=olvmslf70lzd515q63ky90utx&dl=0,"ambidexterity, intertemporal transition, firm performance, firm resources, intangible assets","Research on organizational ambidexterity has long reported contradictory
performance effects: some studies show that balancing exploration and exploitation yields
superior results, whereas others find that focused commitment to one activity is more advantageous.
We argue that these inconsistencies arise because ambidexterity’s costs and benefits
depend on firms’ resource boundary conditions. Building on the distinction between non–scalefree
resources that impose rivalry and trade-offs and scale-free resources—particularly intangible
assets—that can be redeployed at low marginal cost, we develop a resource-contingent theory
of ambidexterity. Using a panel of 1,314 U.S. public firms from 1980 to 2021, we show that under
scarce non–scale-free resources, performance follows an inverted U-shape and ambidexterity
prevails; under resource slack, the curve reverses and focused strategies dominate. We further
demonstrate that while discontinuous jumps between orientations are typically costly, intangible
assets buffer reconfiguration frictions and can convert discontinuous jumps into performanceenhancing
moves. These findings reconcile prior mixed results by identifying resource redeployability
as the microfoundation that conditions when balance, focus, or discontinuous change
creates value.","Luiz Ricardo Kabbach de Castro, Arthur Guimarães Heleno, Luiz Ricardo Kabbach de Castro",Indiana University; Universidad de Navarra,R_3kNTV5GHIpitNlN_To Balance or Not to Balance.pdf,R_3kNTV5GHIpitNlN
P026,Competitive Surprise: How Unexpected Moves Shape Business Rivalry,https://www.dropbox.com/scl/fi/zr21bd6azwi9jazw914qd/R_3kXq6YgMqWIak1i_Competitive-surprise.pdf?rlkey=lbi36yy7ydhtlwbrcawytq373&dl=0,"Competitive Dynamics, Competitive Strategy, Competitive Action, Competitive Surprise, Competitive Interactions","We develop a process-based model of competitive surprise that explains how and when unexpected competitive moves create temporal advantage by impairing a rival’s response. Drawing on the awareness–motivation–capability (AMC) framework and integrating insights from psychology, military strategy, and organization studies, the model specifies both the conditions that create surprise and the mechanisms through which it shapes rival response. In the pre-surprise period, detection and interpretation barriers, such as secrecy, irregular behavior, vague or deceptive communication, and limited rival intelligence, impede early warning and delay preparedness. In the post-surprise period, two opposing mechanisms, evaluation barriers and response incentives, jointly determine the speed and effectiveness of rivals’ responses: evaluation barriers (e.g., decision interruptions, appraisal difficulties) constrain capability, while response incentives (e.g., curiosity, fear, anxiety) shape motivation. We develop propositions on how different types of surprise (novel, incongruent, and misleading) activate these mechanisms to produce distinct response outcomes. Our model contributes to (a) competitive dynamics research by embedding the temporal, cognitive, and emotional dimensions of surprise within the AMC framework, (b) first-mover advantage theory by explaining how psychological and informational asymmetries extend lead time, and (c) literature on organizational responses to unexpected events by integrating proactive and reactive perspectives of surprise.","Goce Andrevski, Ali Ahmadi, Danny Miller",Queen's University; HEC Montreal,R_3kXq6YgMqWIak1i_Competitive surprise.pdf,R_3kXq6YgMqWIak1i
P027,Organizational Repression of Stakeholder Collective Action,https://www.dropbox.com/scl/fi/olyfhxcpyd4ec6to20lhe/R_3lEw1lvqgleTueJ_Organizational-Repression-of-Stakeholder-Collective-Action.pdf?rlkey=xnltnufesdlv0r65u87wj9cns&dl=0,"Social Movements, Stakeholder Management, Repression","Organizations face mounting pressure from stakeholders to change practices and policies, yet scholarly understanding of how organizations manage this pressure remains incomplete. While existing research has examined various organizational responses to stakeholder pressure—including acquiescence, neglect, collaboration, and resistance—they have been predominantly reactive and discrete, overlooking a more systematic approach organizations employ to neutralize stakeholder pressure before it emerges and end it even if it materializes. To address this gap, this paper introduces organizational repression as an integrated strategy aimed at preventing, controlling, or constraining stakeholder collective action from evolving. Drawing on the social movements and state-based repression literatures, we theorize how organizations can effectively undermine collective action by targeting its enabling conditions across three distinct phases: emergence, coalescence and formalization. We propose five key repressive tactics—manipulating threat perceptions, closing opportunity structures, restricting resources, selectively disincentivizing recruits, and fragmenting coalitions of members and allies—and explore how organizations implement each. Ultimately, this paper contributes to the social movements and nonmarket strategy literatures by theorizing organizational repression as a stakeholder management strategy and revealing how organizations can undermine stakeholder efforts to produce organizational and societal change.","Natalie Holzaepfel, Olga Hawn, Timothy Werner",University of North Carolina at Chapel Hill; University of Texas at Austin,R_3lEw1lvqgleTueJ_Organizational Repression of Stakeholder Collective Action.pdf,R_3lEw1lvqgleTueJ
